{
  "id": "audit-runtime-target-pr-review-ag-digitalz-first-content-sprint-v1-20260704",
  "occurredAt": "2026-07-05T04:43:00Z",
  "actor": "ag-os-reviewer",
  "eventType": "validation_run",
  "summary": "Reviewed target repo PR #4 for AG Digitalz First Content Sprint v1 and confirmed scope, safety defaults, draft-only content, and target app checks passed.",
  "scope": "target_pr_review_ag_digitalz_first_content_sprint_v1",
  "source": "manual_review",
  "relatedArtifacts": [
    {
      "type": "pull_request",
      "reference": "https://github.com/gurnoorbassi/ag-social-media-management-system/pull/4"
    },
    {
      "type": "other",
      "reference": "critique-runtime-target-pr-review-ag-digitalz-first-content-sprint-v1-20260704"
    },
    {
      "type": "other",
      "reference": "quality-score-runtime-target-pr-review-ag-digitalz-first-content-sprint-v1-20260704"
    },
    {
      "type": "other",
      "reference": "cost-ledger-runtime-target-pr-review-ag-digitalz-first-content-sprint-v1-20260704"
    }
  ],
  "riskLevel": "medium",
  "dataClassification": "internal",
  "liveServiceTouched": false,
  "notes": "Target PR #4 was open, unmerged, and mergeable at head SHA 02a749ff3348be9c57f34726f104f381e228b1cd. Changed files were exactly README.md, package.json, index.html, src/main.js, src/styles.css, src/data/templates.js, src/lib/safety.js, and src/lib/status.js. Target checks passed: npm.cmd run check, npm.cmd test, npm.cmd run build, direct draft-only safety assertion, and git diff --check. No target PR merge, deployment, Netlify call, n8n activation, social OAuth, credential, posting, scheduling, DM/comment, analytics API, paid tool, production data, customer data, Lead Gen, AI Receptionist, Constitution, accepted lesson, or permanent memory action occurred.",
  "createdAt": "2026-07-05T04:43:00Z"
}
