{
  "id": "audit-20260704-ag-digitalz-first-content-sprint-netlify-staging-executed",
  "occurredAt": "2026-07-05T04:58:46Z",
  "actor": "ag-os-runtime",
  "eventType": "registry_change",
  "summary": "Redeployed the dedicated Social Media Management System Netlify staging-only site after the AG Digitalz First Content Sprint v1 merge.",
  "scope": "live_netlify_staging_redeploy_ag_digitalz_first_content_sprint_v1",
  "source": "connector_metadata",
  "relatedArtifacts": [
    {
      "type": "approval",
      "reference": "approval-20260704-ag-digitalz-first-content-sprint-netlify-staging"
    },
    {
      "type": "other",
      "reference": "connector-exec-20260704-ag-digitalz-first-content-sprint-netlify-staging-live-result"
    },
    {
      "type": "other",
      "reference": "cost-ledger-20260704-ag-digitalz-first-content-sprint-netlify-staging"
    },
    {
      "type": "other",
      "reference": "https://ag-social-media-management-system-staging.netlify.app"
    }
  ],
  "riskLevel": "high",
  "dataClassification": "internal",
  "liveServiceTouched": true,
  "notes": "Executed only the owner-approved staging-only Netlify redeploy for the existing dedicated staging site. Source repo main was verified at c6dc28dee2f50324322c476cb0d4174f853e8d68 before deploy. Netlify returned deploy ready for deploy ID 6a49e480fbe8fbbb83b933dc and HTTP GET returned 200 for the primary staging URL. Netlify labels the deploy context as production because this is the primary deploy context of the dedicated staging-only site, not an AG Digitalz production domain, customer production domain, or production customer system. No DNS change, custom domain, paid feature, sensitive value storage, target repo edit, target PR merge during deploy, social account connection, credential use, posting, scheduling, DM/comment action, analytics API use, n8n activation, live form wiring, tracking script, private client data, production data, customer data, Lead Gen change, AI Receptionist change, or Constitution change occurred.",
  "createdAt": "2026-07-05T04:58:46Z"
}
