{
  "id": "audit-20260703-github-repo-create-executed",
  "occurredAt": "2026-07-03T21:18:06.600Z",
  "actor": "owner-gurnoor-bassi",
  "eventType": "registry_change",
  "summary": "Created one private GitHub repository named gurnoorbassi/ag-test-construction-website with a starter README under approval lock approval-20260703-github-repo-create.",
  "scope": "live_github_repo_creation_ag_test_construction_website",
  "source": "connector_metadata",
  "relatedArtifacts": [
    {
      "type": "approval",
      "reference": "approval-20260703-github-repo-create"
    },
    {
      "type": "other",
      "reference": "connector-exec-20260703-github-repo-create-live-result"
    },
    {
      "type": "other",
      "reference": "https://github.com/gurnoorbassi/ag-test-construction-website"
    }
  ],
  "riskLevel": "high",
  "dataClassification": "internal",
  "liveServiceTouched": true,
  "notes": "Executed exactly one approved GitHub repository creation action. Repository visibility was verified as private through GitHub connector metadata. No Netlify, n8n, deployment, domain or DNS change, paid action, production data, customer data, Lead Gen change, or AI Receptionist change occurred. No secrets were added, viewed, recorded, or stored.",
  "createdAt": "2026-07-03T21:18:06.600Z"
}
