{
  "id": "audit-20260704-ag-digitalz-draft-content-owner-approved",
  "occurredAt": "2026-07-05T06:32:26Z",
  "actor": "owner-gurnoor-bassi",
  "eventType": "approval_granted",
  "summary": "Owner approved the 21 revised AG Digitalz post packages and the weekly report as draft content only.",
  "scope": "ag_digitalz_first_content_sprint_v1_draft_content_only",
  "source": "owner_instruction",
  "relatedArtifacts": [
    {
      "type": "other",
      "reference": ".codex/client-management/content-sprints/content-sprint-ag-digitalz-first-content-sprint-v1.json"
    },
    {
      "type": "other",
      "reference": ".codex/client-management/approvals/client-approval-ag-digitalz-first-post-package-draft.json"
    },
    {
      "type": "other",
      "reference": ".codex/client-management/approvals/client-approval-ag-digitalz-weekly-reporting-setup.json"
    },
    {
      "type": "other",
      "reference": ".codex/client-management/deliverables/deliverable-ag-digitalz-post-package.json"
    },
    {
      "type": "other",
      "reference": ".codex/client-management/deliverables/deliverable-ag-digitalz-weekly-report.json"
    }
  ],
  "riskLevel": "medium",
  "dataClassification": "internal",
  "liveServiceTouched": false,
  "notes": "This approval is draft-content only. It does not authorize live posting, scheduling, social OAuth, account connection, analytics API, DMs/comments, n8n activation, credential storage, domain/DNS changes, paid tools, Lead Gen changes, AI Receptionist changes, Constitution changes, accepted lessons, or permanent memory. Official public handles remain not_provided and pending_owner_input.",
  "createdAt": "2026-07-05T06:32:26Z"
}
