{
  "id": "audit-runtime-target-pr-review-ag-digitalz-content-review-v1-20260704",
  "occurredAt": "2026-07-05T05:39:30Z",
  "actor": "ag-os-reviewer",
  "eventType": "validation_run",
  "summary": "Reviewed target repo PR #5 for AG Digitalz Content Review, Refinement, and Draft Approval Sprint v1 and confirmed scope, safety defaults, draft-only content review state, and target app checks passed.",
  "scope": "target_pr_review_ag_digitalz_content_review_v1",
  "source": "manual_review",
  "relatedArtifacts": [
    {
      "type": "pull_request",
      "reference": "https://github.com/gurnoorbassi/ag-social-media-management-system/pull/5"
    },
    {
      "type": "other",
      "reference": "critique-runtime-target-pr-review-ag-digitalz-content-review-v1-20260704"
    },
    {
      "type": "other",
      "reference": "quality-score-runtime-target-pr-review-ag-digitalz-content-review-v1-20260704"
    },
    {
      "type": "other",
      "reference": "cost-ledger-runtime-target-pr-review-ag-digitalz-content-review-v1-20260704"
    }
  ],
  "riskLevel": "medium",
  "dataClassification": "internal",
  "liveServiceTouched": false,
  "notes": "Target PR #5 was open, unmerged, and mergeable at head SHA 7e49b37330bdd54e598ac82a3ae205519725d795. Changed files were exactly README.md, index.html, package.json, src/data/templates.js, src/lib/safety.js, src/lib/status.js, src/main.js, and src/styles.css. Target checks passed: npm.cmd run check, npm.cmd test, npm.cmd run build, direct content-review safety assertion, and git diff --check. Review confirmed 21 draft post packages reviewed, 21 revised, 21 approved_draft, 0 needs_revision, 0 blocked_by_missing_proof, 0 blocked_by_missing_handle, one weekly report draft, and four platform handles still not_provided. No target PR merge, deployment, Netlify call, n8n activation, social OAuth, credential, posting, scheduling, DM/comment, analytics API, paid tool, production data, private client data, Lead Gen, AI Receptionist, Constitution, accepted lesson, or permanent memory action occurred.",
  "createdAt": "2026-07-05T05:39:30Z"
}
