{
  "id": "audit-20260703-github-repo-create-owner-approved",
  "occurredAt": "2026-07-03T21:06:41Z",
  "actor": "owner-gurnoor-bassi",
  "eventType": "approval_granted",
  "summary": "Owner approved an active approval lock for one future live GitHub repo creation: a private repository named ag-test-construction-website. No repository was created by this audit event.",
  "scope": "approval-20260703-github-repo-create",
  "source": "owner_instruction",
  "relatedArtifacts": [
    {
      "type": "approval",
      "reference": "approval-20260703-github-repo-create"
    },
    {
      "type": "other",
      "reference": ".codex/approvals/approval-20260703-github-repo-create.json"
    },
    {
      "type": "other",
      "reference": ".codex/github/github-plan-runtime-github-construction-website-repo-20260703.json"
    },
    {
      "type": "other",
      "reference": ".codex/github/github-mcp-gate-runtime-github-construction-website-repo-20260703.json"
    },
    {
      "type": "other",
      "reference": ".codex/audit/audit-runtime-github-construction-website-repo-20260703-github-dry-run.json"
    }
  ],
  "riskLevel": "high",
  "dataClassification": "internal",
  "liveServiceTouched": false,
  "notes": "This audit event records approval only. It does not create a GitHub repository, call GitHub MCP, deploy, change DNS, use paid services, access credentials, or touch production/customer data.",
  "createdAt": "2026-07-03T21:06:41Z"
}
