{
  "id": "audit-20260704-ag-digitalz-draft-config-build-executed",
  "occurredAt": "2026-07-05T01:52:50Z",
  "actor": "ag-os-runtime",
  "eventType": "registry_change",
  "summary": "Executed the approved AG Digitalz draft client config GitHub builder milestone by creating one branch, updating approved draft/staging starter files, and opening one pull request in gurnoorbassi/ag-social-media-management-system.",
  "scope": "live_github_builder_pr_ag_digitalz_draft_config",
  "source": "connector_metadata",
  "relatedArtifacts": [
    {
      "type": "approval",
      "reference": "approval-20260704-ag-digitalz-draft-config-build"
    },
    {
      "type": "other",
      "reference": "connector-exec-20260704-ag-digitalz-draft-config-build-live-result"
    },
    {
      "type": "other",
      "reference": "cost-ledger-20260704-ag-digitalz-draft-config-build"
    },
    {
      "type": "pull_request",
      "reference": "https://github.com/gurnoorbassi/ag-social-media-management-system/pull/3"
    }
  ],
  "riskLevel": "high",
  "dataClassification": "internal",
  "liveServiceTouched": true,
  "notes": "The action stayed inside the approved target repository and branch. The target PR was opened but not merged. No repository creation, deployment, Netlify, n8n activation, domain or DNS change, paid action, credential, social account connection, posting, scheduling, DM, comment, analytics API usage, production data, customer private data, Lead Gen change, AI Receptionist change, Constitution change, additional repository, additional branch, or additional pull request occurred.",
  "createdAt": "2026-07-05T01:52:50Z"
}
