{
  "id": "audit-20260704-ag-digitalz-draft-approval-build-executed",
  "occurredAt": "2026-07-05T06:37:48Z",
  "actor": "ag-os-runtime",
  "eventType": "registry_change",
  "summary": "Executed the approved target app update by creating one branch, updating the draft/staging Social Media app to show owner_approved_draft state, and opening target PR #6.",
  "scope": "ag_digitalz_draft_approval_target_app_update_v1",
  "source": "connector_metadata",
  "relatedArtifacts": [
    {
      "type": "approval",
      "reference": "approval-20260704-ag-digitalz-draft-approval-oauth-readiness"
    },
    {
      "type": "pull_request",
      "reference": "https://github.com/gurnoorbassi/ag-social-media-management-system/pull/6"
    },
    {
      "type": "other",
      "reference": "connector-exec-20260704-ag-digitalz-draft-approval-build-live-result"
    },
    {
      "type": "other",
      "reference": "cost-ledger-20260704-ag-digitalz-draft-approval-build"
    }
  ],
  "riskLevel": "high",
  "dataClassification": "internal",
  "liveServiceTouched": true,
  "notes": "The action stayed inside the approved target repository and branch. No deployment, Netlify call, n8n activation, social account connection, OAuth, credentials, posting, scheduling, analytics API, DMs/comments, paid tools, real client private data, Lead Gen, AI Receptionist, Constitution, accepted lesson, or permanent memory action occurred.",
  "createdAt": "2026-07-05T06:37:48Z"
}
