{
  "id": "audit-runtime-target-pr-review-social-media-system-v1-1-20260704",
  "occurredAt": "2026-07-05T00:51:42Z",
  "actor": "ag-os-reviewer",
  "eventType": "validation_run",
  "summary": "Reviewed target repo pull request gurnoorbassi/ag-social-media-management-system#2 before any merge.",
  "scope": "runtime-target-pr-review-social-media-system-v1-1-20260704",
  "source": "manual_review",
  "relatedArtifacts": [
    {
      "type": "pull_request",
      "reference": "https://github.com/gurnoorbassi/ag-social-media-management-system/pull/2"
    },
    {
      "type": "approval",
      "reference": "approval-20260704-social-media-system-v1-1-upgrade"
    },
    {
      "type": "other",
      "reference": ".codex/connectors/connector-exec-20260704-social-media-system-v1-1-upgrade-live-result.json"
    },
    {
      "type": "other",
      "reference": "runtime-target-pr-review-social-media-system-v1-1-20260704"
    }
  ],
  "riskLevel": "medium",
  "dataClassification": "internal",
  "liveServiceTouched": false,
  "notes": "Read-only review only. Target PR #2 was inspected and left open and unmerged. Reviewed files were README.md, package.json, index.html, src/main.js, src/styles.css, src/data/templates.js, src/lib/safety.js, and src/lib/status.js. Target checks passed: npm.cmd run check, npm.cmd test, npm.cmd run build, and git diff --check. Review confirmed the app remains static and draft/staging only, keeps first-client setup in intake-needed state, uses REQUIRED_ placeholders only, blocks social OAuth, credentials, live posting, scheduling, analytics API, n8n activation, paid tools, and production deployment, and does not include tracking scripts, external API calls, live form wiring, real client private data, deployment config, target PR merge, Netlify action, Lead Gen change, AI Receptionist change, or Constitution change.",
  "createdAt": "2026-07-05T00:51:42Z"
}
