{
  "id": "audit-runtime-target-pr-review-ag-digitalz-instagram-handle-20260705",
  "occurredAt": "2026-07-05T19:08:24Z",
  "actor": "ag-os-runtime",
  "eventType": "registry_change",
  "summary": "Reviewed Social Media Management System target PR #8 for the Instagram public handle update before merge.",
  "scope": "target_pr_review_ag_digitalz_instagram_handle",
  "source": "connector_metadata",
  "relatedArtifacts": [
    {
      "type": "approval",
      "reference": "approval-20260705-ag-digitalz-instagram-handle-live-update"
    },
    {
      "type": "pull_request",
      "reference": "https://github.com/gurnoorbassi/ag-social-media-management-system/pull/8"
    },
    {
      "type": "other",
      "reference": "critique-runtime-target-pr-review-ag-digitalz-instagram-handle-20260705"
    },
    {
      "type": "other",
      "reference": "quality-score-runtime-target-pr-review-ag-digitalz-instagram-handle-20260705"
    }
  ],
  "riskLevel": "high",
  "dataClassification": "public",
  "liveServiceTouched": true,
  "notes": "Review confirmed PR #8 changed only README.md, package.json, src/data/templates.js, src/lib/safety.js, and src/main.js. Instagram was set to @agdigitalz as public business metadata. TikTok, YouTube Shorts, and LinkedIn remain not_provided and pending owner input. All platform accounts remain not_connected, draft_only, approval_required true, live_posting_blocked true, scheduling blocked, analytics blocked, social OAuth disconnected, and credentials stored false. Local target checks passed. No OAuth, social account connection, credential, posting, scheduling, analytics API, DMs/comments, n8n activation, paid tool, domain/DNS, real client private data, Lead Gen, AI Receptionist, Constitution, accepted lesson, or permanent memory action occurred.",
  "createdAt": "2026-07-05T19:10:50Z"
}
