{
  "id": "audit-runtime-approval-20260709-ag-os-codex-draft-pr-standing-use-10",
  "occurredAt": "2026-07-16T19:41:34.488Z",
  "actor": "agent-codex",
  "eventType": "standing_approval_used",
  "summary": "Standing approval approval-20260709-ag-os-codex-draft-pr-standing used for codex branch push and draft PR creation.",
  "scope": "gurnoorbassi/ag-os:codex/watchdog-resolution-controls-20260716",
  "source": "connector_metadata",
  "relatedArtifacts": [
    {
      "type": "approval",
      "reference": "approval-20260709-ag-os-codex-draft-pr-standing"
    },
    {
      "type": "pull_request",
      "reference": "https://github.com/gurnoorbassi/ag-os/pull/151"
    }
  ],
  "riskLevel": "medium",
  "dataClassification": "internal",
  "liveServiceTouched": true,
  "notes": "Use 10 of 10. Secret scan and all required local gates passed. Merge remains prohibited. Changed files: dashboard/app.js, dashboard/styles.css, scripts/lib/runtime/operational-safeguards.mjs, scripts/live-server.mjs, tests/operational-safeguards.test.mjs.",
  "createdAt": "2026-07-16T19:41:34.488Z"
}
