{
  "id": "audit-20260704-target-pr-merge-executed",
  "occurredAt": "2026-07-04T10:18:46.000Z",
  "actor": "ag-os-runtime",
  "eventType": "safe_merge",
  "summary": "Merged the reviewed target repo pull request gurnoorbassi/ag-test-construction-website#1 into main under scoped owner approval.",
  "scope": "live_target_pr_merge_ag_test_construction_website",
  "source": "connector_metadata",
  "relatedArtifacts": [
    {
      "type": "approval",
      "reference": "approval-20260704-target-pr-merge-construction-website"
    },
    {
      "type": "other",
      "reference": "connector-exec-20260704-target-pr-merge-live-result"
    },
    {
      "type": "other",
      "reference": "cost-ledger-20260704-target-pr-merge-construction-website"
    },
    {
      "type": "pull_request",
      "reference": "https://github.com/gurnoorbassi/ag-test-construction-website/pull/1"
    },
    {
      "type": "commit",
      "reference": "8c635538d7d5b7bb9918d2ea900c8f934ee98d49"
    }
  ],
  "riskLevel": "high",
  "dataClassification": "internal",
  "liveServiceTouched": true,
  "notes": "Executed exactly the owner-approved target repository merge: merged PR #1 into main in gurnoorbassi/ag-test-construction-website. The target PR head was unchanged from the AG OS review, and the changed file set remained README.md, package.json, index.html, src/styles.css, and src/main.js. No deployment, Netlify, n8n, domain or DNS change, paid action, credential, tracking script, wired live form, production data, customer data, Lead Gen change, AI Receptionist change, Constitution change, additional repository, additional branch, additional pull request, or target repo content edit occurred during this merge action.",
  "createdAt": "2026-07-04T10:18:46.000Z"
}
