{
  "id": "audit-runtime-ag-os-accepted-lesson-reuse-proof-20260713",
  "occurredAt": "2026-07-13T09:35:20.601Z",
  "actor": "owner-gurnoor-bassi",
  "eventType": "validation_run",
  "summary": "Accepted AG OS lesson and relevant skills were retrieved into a later project plan; completion produced quality, lesson, cost, and safety evidence.",
  "scope": "runtime_compounding_proof",
  "source": "local_validation",
  "relatedArtifacts": [],
  "riskLevel": "low",
  "dataClassification": "internal",
  "liveServiceTouched": false,
  "createdAt": "2026-07-13T09:35:20.601Z"
}
