{
  "id": "audit-runtime-approval-20260709-ag-os-codex-draft-pr-standing-use-1",
  "occurredAt": "2026-07-13T09:38:26.400Z",
  "actor": "agent-codex",
  "eventType": "standing_approval_used",
  "summary": "Standing approval approval-20260709-ag-os-codex-draft-pr-standing used for codex branch push and draft PR creation.",
  "scope": "gurnoorbassi/ag-os:codex/complete-roadmap-work-20260713",
  "source": "connector_metadata",
  "relatedArtifacts": [
    {
      "type": "approval",
      "reference": "approval-20260709-ag-os-codex-draft-pr-standing"
    },
    {
      "type": "pull_request",
      "reference": "https://github.com/gurnoorbassi/ag-os/pull/135"
    }
  ],
  "riskLevel": "medium",
  "dataClassification": "internal",
  "liveServiceTouched": true,
  "notes": "Use 1 of 10. Secret scan and all required local gates passed. Merge remains prohibited. Changed files: .codex/approvals/approval-20260713-h3-compounding-proof.json, .codex/audit/audit-runtime-ag-os-accepted-lesson-reuse-proof-20260713.json, .codex/audit/audit-runtime-ag-os-compounding-completion-20260713.json, .codex/audit/audit-runtime-h3-compounding-proof-approval-granted.json, .codex/audit/audit-runtime-social-doc-consolidation-20260713.json, .codex/commands/command-intake-runtime-ag-os-accepted-lesson-reuse-proof-20260713.json, .codex/commands/command-intake-runtime-ag-os-compounding-completion-20260713.json, .codex/commands/command-intake-runtime-social-doc-consolidation-20260713.json, .codex/costs/cost-ledger-runtime-ag-os-accepted-lesson-reuse-proof-20260713.json, .codex/costs/cost-ledger-runtime-ag-os-compounding-completion-20260713.json, .codex/costs/cost-ledger-runtime-social-doc-consolidation-20260713.json, .codex/execution/exec-runtime-ag-os-accepted-lesson-reuse-proof-20260713-run-validation.json, .codex/execution/exec-runtime-ag-os-compounding-completion-20260713-run-validation.json, .codex/execution/exec-runtime-social-doc-consolidation-20260713-run-validation.json, .codex/jobs/job-runtime-ag-os-accepted-lesson-reuse-proof-20260713.json, .codex/jobs/job-runtime-ag-os-compounding-completion-20260713.json, .codex/jobs/job-runtime-social-doc-consolidation-20260713.json, .codex/memory/accepted/lesson-20260713-runtime-ag-os-compounding-completion-20260713-03.json, .codex/memory/archetype-updates/archetype-update-lesson-20260713-runtime-ag-os-compounding-completion-20260713-03-archetype-dashboard-qualitychecklist.json, .codex/memory/lessons/candidates/lesson-20260713-runtime-ag-os-accepted-lesson-reuse-proof-20260713-01.json, .codex/memory/lessons/candidates/lesson-20260713-runtime-ag-os-accepted-lesson-reuse-proof-20260713-02.json, .codex/memory/lessons/candidates/lesson-20260713-runtime-ag-os-accepted-lesson-reuse-proof-20260713-03.json, .codex/memory/lessons/candidates/lesson-20260713-runtime-ag-os-compounding-completion-20260713-01.json, .codex/memory/lessons/candidates/lesson-20260713-runtime-ag-os-compounding-completion-20260713-02.json, .codex/memory/lessons/candidates/lesson-20260713-runtime-ag-os-compounding-completion-20260713-03.json, .codex/memory/lessons/candidates/lesson-20260713-runtime-social-doc-consolidation-20260713-01.json, .codex/memory/lessons/candidates/lesson-20260713-runtime-social-doc-consolidation-20260713-02.json, .codex/memory/lessons/candidates/lesson-20260713-runtime-social-doc-consolidation-20260713-03.json, .codex/plans/plan-runtime-ag-os-accepted-lesson-reuse-proof-20260713.json, .codex/plans/plan-runtime-ag-os-compounding-completion-20260713.json, .codex/plans/plan-runtime-social-doc-consolidation-20260713.json, .codex/quality-scores/quality-score-20260713-runtime-ag-os-accepted-lesson-reuse-proof-20260713.json, .codex/quality-scores/quality-score-20260713-runtime-ag-os-compounding-completion-20260713.json, .codex/quality-scores/quality-score-20260713-runtime-social-doc-consolidation-20260713.json, .codex/router/route-runtime-ag-os-accepted-lesson-reuse-proof-20260713.json, .codex/router/route-runtime-ag-os-compounding-completion-20260713.json, .codex/router/route-runtime-social-doc-consolidation-20260713.json, README.md, dashboard/app.js, dashboard/dashboard-data.js, dashboard/index.html, dashboard/styles.css, docs/ag-os-vision-roadmap-v1.md, docs/ajv-migration-decision.md, docs/boot-sequence-runner.md, docs/constitution-readiness.md, docs/documentation-map.md, schemas/plan.schema.json, scripts/lib/runtime/command-intake-processor.mjs, scripts/lib/runtime/live-command-service.mjs, scripts/lib/runtime/metrics-processor.mjs, scripts/lib/runtime/planner-processor.mjs, scripts/lib/runtime/skill-retrieval.mjs, scripts/live-server.mjs, scripts/load-accepted-lessons.mjs, scripts/process-command-intake.mjs, scripts/process-lesson-promotion.mjs, tests/command-intake-processor.test.mjs, tests/live-command-service.test.mjs, tests/metrics-processor.test.mjs, tests/planner-processor.test.mjs, tests/skill-retrieval.test.mjs, tests/unified-memory-learning.test.mjs.",
  "createdAt": "2026-07-13T09:38:26.400Z"
}
